scheme_name,full_name,description,eligibility,benefits,website,category,launched_year
PM-KISAN,Pradhan Mantri Kisan Samman Nidhi,Income support of ₹6000 per year to all landholding farmer families,All landholding farmer families,₹2000 every 4 months in 3 installments,https://pmkisan.gov.in/,Income Support,2019
PMFBY,Pradhan Mantri Fasal Bima Yojana,Crop insurance scheme providing financial support against crop loss,All farmers growing notified crops,Insurance coverage for crop loss due to natural calamities,https://pmfby.gov.in/,Insurance,2016
Soil Health Card,Soil Health Card Scheme,Provides soil health cards with nutrient status and recommendations,All farmers,Free soil testing and fertilizer recommendations,https://soilhealth.dac.gov.in/,Soil Management,2015
KCC,Kisan Credit Card,Credit facility for farmers for agricultural and allied activities,Farmers with land ownership or tenant farmers,Easy credit at subsidized interest rates up to ₹3 lakh,https://www.india.gov.in/spotlight/kisan-credit-card-kcc,Credit,1998
PMKSY,Pradhan Mantri Krishi Sinchayee Yojana,Irrigation scheme to improve water use efficiency - Har Khet Ko Pani,All farmers,"Subsidy on drip/sprinkler irrigation, farm ponds",https://pmksy.gov.in/,Irrigation,2015
PKVY,Paramparagat Krishi Vikas Yojana,Promotes organic farming and reduces chemical fertilizer use,Farmers willing to adopt organic farming,"₹50,000 per hectare for 3 years",https://pgsindia-ncof.gov.in/,Organic Farming,2015
e-NAM,National Agriculture Market,Online trading platform for agricultural commodities,All farmers and traders,"Better price discovery, transparent auction process",https://enam.gov.in/,Marketing,2016
NFSM,National Food Security Mission,"Increase production of rice, wheat, pulses, coarse cereals",Farmers in identified districts,"Subsidized seeds, equipment, training",https://nfsm.gov.in/,Production,2007
